{
  "schema_version": "1.0",
  "scheme": "ecdsa-p256-quorum",
  "threshold": {
    "k": 2,
    "n": 3
  },
  "committed": {
    "record_type": "ProofArtifact",
    "entry_hash": "sha256:9ebc57892b19943ea7d5baa3b23f622aba8bc7bb095c59a5e6ae304229729ee0"
  },
  "signed_payload_hash": "sha256:6ac6a0c28af2008ffbf5d8a541574b6a0844c608d79f31a49f2d5975d755e08f",
  "roster": [
    {
      "witness_id": "witness-a",
      "alg": "ECDSA_P256_SHA256",
      "public_key_spki_b64": "MFkwEwYHKoZIzj0CAQYIKoZIzj0DAQcDQgAE5CvZ0ctAHeErRW7eJRlyN8yGbHuXIU1TdQbpBvRGxu4d5LFpil7ZYucD3CoSOq2nv6QCj+A/6PXwFzW5qqsN2w=="
    },
    {
      "witness_id": "witness-b",
      "alg": "ECDSA_P256_SHA256",
      "public_key_spki_b64": "MFkwEwYHKoZIzj0CAQYIKoZIzj0DAQcDQgAEkF0WwIxYVnSOoC0Mwzsar61rPksxQikwnBetwQa9chuwfTw3p8fs2v6Ee4xI8JwvEYLVRY9ENcwm5HK425Pv5w=="
    },
    {
      "witness_id": "witness-c",
      "alg": "ECDSA_P256_SHA256",
      "public_key_spki_b64": "MFkwEwYHKoZIzj0CAQYIKoZIzj0DAQcDQgAEj9v2xbwQGRBBMYJwW5bfei0W+T/R/FXRaJ3XeQf18TrQd7k5Kz/ROA6pRmmMV8typJog5fV87KP9wtPqchS91A=="
    }
  ],
  "signatures": [
    {
      "witness_id": "witness-a",
      "sig_b64": "MEUCIAoKa2P5X15l+K7kRllTyVlzCnOlILHk8u3cXBQUcRYvAiEAxP8x3Jo7zOxfkLVD5UQnT/1MLpsJUGzXYGtkuWrva34="
    },
    {
      "witness_id": "witness-b",
      "sig_b64": "MEUCIENavm0WScns8weKgaAxla0537fGPSgUbzCFf3GngVDlAiEAr+e2K2doKcaUuvpZ+ZzqEkMq1mk4LhJEm3LSCsHhi5s="
    }
  ],
  "fips_posture": "ecdsa-p256-quorum: independent per-witness ECDSA P-256 / SHA-256 signatures (FIPS 186-4; 140-3 approvable) verified k-of-N. FROST/Schnorr-ed25519 is NOT FIPS-approved and is NOT used here; it is the advisory path pending a FIPS-validated implementation."
}
